{
  "$schema": "https://json-schema.org/draft/2020-12/schema",
  "title": "Investigation save envelope",
  "type": "object",
  "required": [
    "format",
    "schemaVersion",
    "contractVersion",
    "caseId",
    "contentVersion",
    "state"
  ],
  "additionalProperties": false,
  "properties": {
    "format": {
      "const": "security-lab-investigation"
    },
    "schemaVersion": {
      "const": 1
    },
    "contractVersion": {
      "const": 1
    },
    "caseId": {
      "const": "residual-permissions"
    },
    "contentVersion": {
      "type": "string"
    },
    "state": {
      "type": "object",
      "required": [
        "schemaVersion",
        "day",
        "revision",
        "ended",
        "ops",
        "tasks",
        "records",
        "known",
        "evidence",
        "baseline",
        "introduced",
        "statements",
        "eventIds",
        "documents",
        "messages",
        "report",
        "memo"
      ],
      "properties": {
        "day": {
          "type": "integer",
          "minimum": 1,
          "maximum": 7
        },
        "revision": {
          "type": "integer",
          "minimum": 0,
          "maximum": 2147483647
        },
        "memo": {
          "type": "string",
          "maxLength": 4000
        },
        "casework": {
          "type": "object",
          "additionalProperties": false,
          "required": [
            "version",
            "phase",
            "minute",
            "links",
            "control",
            "stagingIsolated",
            "dispatch",
            "receipt",
            "final",
            "ending"
          ],
          "properties": {
            "version": {
              "enum": [
                1,
                2
              ]
            },
            "phase": {
              "enum": [
                "morning",
                "dispatching",
                "after",
                "replies"
              ]
            },
            "minute": {
              "enum": [
                540,
                1050,
                1051,
                1055
              ]
            },
            "links": {
              "type": "object"
            },
            "control": {
              "type": "object",
              "required": [
                "approved",
                "mode"
              ],
              "additionalProperties": false,
              "properties": {
                "approved": {
                  "type": "boolean"
                },
                "mode": {
                  "enum": [
                    "none",
                    "blocked_pre_run",
                    "blocked_during"
                  ]
                }
              }
            },
            "stagingIsolated": {
              "type": "boolean"
            },
            "dispatch": {
              "enum": [
                "pending",
                "not_run",
                "blocked",
                "sent"
              ]
            },
            "receipt": {
              "enum": [
                "none",
                "unconfirmed",
                "confirmed"
              ]
            },
            "final": {
              "type": "object"
            },
            "ending": {
              "type": "object"
            }
          }
        }
      }
    }
  }
}
